{
  "id": "glass-prism",
  "name": "Equilateral Glass Prism",
  "category": "physics",
  "type": "prop",
  "version": "0.1.0",
  "status": "final",
  "semanticDescription": "Equilateral 60° optical crown glass dispersion prism (side 65mm, height 75mm, n = 1.52) mounted on a turned brass spectrometer turntable, demonstrating Newton's dispersion of white light into the 7 spectral rainbow colors VIBGYOR (CBSE Class 10 Ch 11).",
  "scaleConvention": {
    "unit": "meter",
    "basis": "real-world-scale",
    "width": 0.28,
    "height": 0.12,
    "depth": 0.22
  },
  "simplifications": [
    "Standard 60° equilateral laboratory geometry.",
    "Spectral fan discretely traces the 7 canonical rainbow wavelengths (ROYGBIV) onto observation screen."
  ],
  "materials": [
    {
      "id": "prism-glass-clear",
      "look": "Polished optical crown glass (IOR 1.52, transmission 1.0)"
    },
    {
      "id": "prism-brass",
      "look": "Turned brass spectrometer turntable with graduated degree circle"
    },
    {
      "id": "sec-beam-white",
      "look": "Collimated incident white light pencil beam"
    },
    {
      "id": "sec-white-screen",
      "look": "Diffusion matte white observation projection screen"
    }
  ],
  "provenance": {
    "method": "procedural-blender-python",
    "generator": "build_prism.py",
    "generatedBy": "AI coding agent",
    "license": "project-original",
    "date": "2026-09-25"
  },
  "rendererCompatibility": {
    "blender": true,
    "three": "import out/glass-prism.glb",
    "remotion": "use out/preview.png"
  },
  "outputs": [
    {
      "file": "out/glass-prism.blend",
      "kind": "blender-scene"
    },
    {
      "file": "out/glass-prism.glb",
      "kind": "glTF-binary"
    },
    {
      "file": "out/preview.png",
      "kind": "preview-render"
    },
    {
      "file": "out/preview_section.png",
      "kind": "preview-render"
    }
  ],
  "tags": [
    "prism",
    "dispersion",
    "spectrum",
    "optics",
    "light"
  ]
}