{
  "id": "digestive-system",
  "name": "Human Digestive System (Gastrointestinal Tract & Accessory Organs)",
  "category": "biology",
  "type": "prop",
  "version": "0.2.0",
  "status": "reviewed",
  "semanticDescription": "Anatomically accurate 3D model of the human digestive system including Esophagus, Stomach, Liver, Gallbladder, Pancreas, Small Intestine (Jejunum), Large Intestine (Transverse & Sigmoid Colon), and Vermiform Appendix. Extracted from Z-Anatomy. Aligned with CBSE Class 10 Life Processes (Nutrition).",
  "scaleConvention": {
    "unit": "meter",
    "basis": "real-world-scale"
  },
  "materials": [
    { "id": "gi-esophagus", "look": "Soft pinkish muscular swallowing tube" },
    { "id": "gi-stomach", "look": "Coral muscular digestive reservoir" },
    { "id": "gi-liver", "look": "Reddish-brown hepatic metabolic gland" },
    { "id": "gi-gallbladder", "look": "Emerald green bile storage sac" },
    { "id": "gi-pancreas", "look": "Golden-amber exocrine/endocrine gland" },
    { "id": "gi-small-intestine", "look": "Warm pink nutrient absorption loops" },
    { "id": "gi-large-intestine", "look": "Tan segmented water absorption colon" }
  ],
  "provenance": {
    "method": "scanned-sourced",
    "source": "https://github.com/Z-Anatomy/Z-Anatomy",
    "generator": "tools/extract_z_anatomy_digestive.py",
    "generatedBy": "Z-Anatomy (CC BY-SA 4.0)",
    "license": "CC BY-SA 4.0",
    "date": "2026-08-27"
  },
  "rendererCompatibility": {
    "blender": true,
    "three": "import out/digestive-system.glb",
    "remotion": "use out/preview.png"
  },
  "outputs": [
    { "file": "out/digestive-system.blend", "kind": "blender-scene" },
    { "file": "out/digestive-system.glb", "kind": "glTF-binary" },
    { "file": "out/preview.png", "kind": "preview-render" }
  ],
  "tags": [
    "digestive-system",
    "stomach",
    "liver",
    "pancreas",
    "intestine",
    "nutrition",
    "life-processes",
    "cbse-class-10"
  ]
}