{
  "id": "brain",
  "name": "Human Brain (Cerebrum, Cerebellum & Brainstem)",
  "category": "biology",
  "type": "prop",
  "version": "0.2.0",
  "status": "reviewed",
  "semanticDescription": "Anatomically accurate 3D model of the human brain showing Cerebrum with cortical sulci/gyri (Frontal, Parietal, Temporal, Occipital lobes), Cerebellum, Pons, Medulla Oblongata, and Corpus Callosum. Extracted from Z-Anatomy. Aligned with CBSE Class 10 Chapter 6 (Control and Coordination).",
  "scaleConvention": {
    "unit": "meter",
    "basis": "real-world-scale"
  },
  "materials": [
    { "id": "brain-cerebrum", "look": "Soft organic cortical pink-beige" },
    { "id": "brain-cerebellum", "look": "Terra-cotta cerebellar folia" },
    { "id": "brain-stem", "look": "Light ivory pons and medulla oblongata" },
    { "id": "brain-deep", "look": "Warm ivory corpus callosum and thalamus" }
  ],
  "provenance": {
    "method": "scanned-sourced",
    "source": "https://github.com/Z-Anatomy/Z-Anatomy",
    "generator": "tools/extract_z_anatomy_brain.py",
    "generatedBy": "Z-Anatomy (CC BY-SA 4.0)",
    "license": "CC BY-SA 4.0",
    "date": "2026-08-27"
  },
  "rendererCompatibility": {
    "blender": true,
    "three": "import out/brain.glb",
    "remotion": "use out/preview.png"
  },
  "outputs": [
    { "file": "out/brain.blend", "kind": "blender-scene" },
    { "file": "out/brain.glb", "kind": "glTF-binary" },
    { "file": "out/preview.png", "kind": "preview-render" }
  ],
  "tags": [
    "brain",
    "cerebrum",
    "cerebellum",
    "brainstem",
    "pons",
    "medulla",
    "nervous-system",
    "cbse-class-10"
  ]
}