{
  "id": "test-tube",
  "name": "Test Tube",
  "category": "chemistry",
  "type": "prop",
  "version": "0.1.0",
  "status": "final",
  "semanticDescription": "Standard 16x140mm borosilicate glass test tube with true hemispherical base and beaded rim, mounted upright in a laboratory hardwood rack block, containing reddish-amber iodine solution with concave wetting meniscus.",
  "scaleConvention": {
    "unit": "meter",
    "basis": "real-world-scale",
    "width": 0.18,
    "height": 0.16,
    "depth": 0.16
  },
  "simplifications": [
    "Wall thickness standardized to 1.2mm borosilicate laboratory standard.",
    "Section view bisects cylindrical tube along Y=0 to exhibit hemispherical bottom curvature and liquid wetting profile."
  ],
  "materials": [
    {
      "id": "tube-glass",
      "look": "Transparent Pyrex borosilicate glass (IOR 1.52, roughness 0.012)"
    },
    {
      "id": "tube-liquid",
      "look": "Reddish-amber iodine solution (IOR 1.333)"
    },
    {
      "id": "tube-rack-wood",
      "look": "Polished laboratory hardwood test tube rack block"
    }
  ],
  "provenance": {
    "method": "procedural-blender-python",
    "generator": "build_test_tube.py",
    "generatedBy": "AI coding agent",
    "license": "project-original",
    "date": "2026-09-25"
  },
  "rendererCompatibility": {
    "blender": true,
    "three": "import out/test-tube.glb",
    "remotion": "use out/preview.png or render frames"
  },
  "outputs": [
    {
      "file": "out/test-tube.blend",
      "kind": "blender-scene"
    },
    {
      "file": "out/test-tube.glb",
      "kind": "glTF-binary"
    },
    {
      "file": "out/preview.png",
      "kind": "preview-render"
    },
    {
      "file": "out/preview_section.png",
      "kind": "preview-render"
    }
  ],
  "tags": [
    "test-tube",
    "glass",
    "laboratory",
    "reaction"
  ]
}