{
  "id": "solenoid",
  "name": "Helical Solenoid with Magnetic Field Lines",
  "category": "physics",
  "type": "prop",
  "version": "1.2.0",
  "status": "final",
  "semanticDescription": "Complete laboratory apparatus demonstrating magnetic field pattern through and around a current-carrying helical solenoid as specified in CBSE Class 10 Physics (NCERT Fig 13.10). Features dual presentation collections: 'Solenoid_Full' (complete laboratory bench assembly with insulating support base, non-slip feet, saddle cradles, acrylic former tube wound with 16 uniform turns of glossy enameled copper wire, machined brass knurled terminal posts with positive red and negative black collars, connecting lead wires, red North (+X) and blue South (-X) polarity badges, and 3D dipolar looping external magnetic field lines with directional flow arrows) and 'Solenoid_Section' (longitudinal cutaway exposing wire cross sections showing current entry/exit symbols and the internal dense, parallel, uniform magnetic field lines B = μ₀nI with directional chevrons traveling from South to North).",
  "scaleConvention": {
    "unit": "meter",
    "basis": "real-world-scale",
    "width": 0.25,
    "height": 0.10,
    "depth": 0.12
  },
  "simplifications": [
    "Wire radius (2.2mm) and magnetic flux tubes (0.9mm) are visually optimized for crisp rendering across 3D interactive viewers and video compositions.",
    "Section cutaway removes front half of core and windings (y < 0) to clearly reveal internal parallel flux lines."
  ],
  "materials": [
    {
      "id": "solenoid-copper",
      "look": "Machined high-purity enameled copper magnet wire (metallic 0.96, roughness 0.20)"
    },
    {
      "id": "solenoid-base",
      "look": "Matte bakelite / slate laboratory bench base with molded support cradles"
    },
    {
      "id": "solenoid-core-tube",
      "look": "Precision cylindrical dielectric acrylic former tube"
    },
    {
      "id": "terminal-brass",
      "look": "Turned brass knurled binding posts with color-coded polarity collars"
    },
    {
      "id": "polarity-badges",
      "look": "Anodized crimson North badge and cobalt South badge with embossed lettering"
    },
    {
      "id": "magnetic-flux-field",
      "look": "Luminescent cyan magnetic flux vector tubes (emission 14.0) with directional conical arrows"
    }
  ],
  "provenance": {
    "method": "procedural-blender-python",
    "generator": "build_solenoid.py",
    "generatedBy": "AI coding agent",
    "license": "project-original",
    "date": "2026-09-23"
  },
  "rendererCompatibility": {
    "blender": true,
    "three": "import out/solenoid.glb",
    "remotion": "use out/preview.png or out/preview_section.png"
  },
  "outputs": [
    {
      "file": "out/solenoid.blend",
      "kind": "blender-scene"
    },
    {
      "file": "out/solenoid.glb",
      "kind": "glTF-binary"
    },
    {
      "file": "out/preview.png",
      "kind": "preview-render"
    },
    {
      "file": "out/preview_section.png",
      "kind": "preview-render"
    }
  ],
  "tags": [
    "solenoid",
    "electromagnet",
    "magnetic-field",
    "helical-coil",
    "uniform-field",
    "copper-wire",
    "CBSE-class-10",
    "electromagnetism"
  ]
}